{
  "slug": "brief",
  "type": "composite",
  "summary": "Interrogate and reframe a creative request, then write a creative brief downstream skills consume",
  "tags": [
    "brief",
    "strategy",
    "reframe"
  ],
  "triggers": [
    "new creative request",
    "brief",
    "make it cooler",
    "is this the right artifact",
    "what should we make",
    "new brand from zero",
    "founder interview"
  ],
  "required_inputs": [
    "owner request"
  ],
  "outputs": [
    "briefs/*.founder-brief.yaml",
    "briefs/*.creative-brief.yaml"
  ],
  "cost_class": "free",
  "context_class": "s",
  "mutating": true,
  "handoff": [
    "workflow",
    "taste-search",
    "cultural-scan",
    "creative-direction",
    "copywriting",
    "claims-proof"
  ],
  "approval_gates": [
    {
      "id": "brief",
      "after_step": "write brief",
      "artifact": "briefs/*.creative-brief.yaml",
      "never_self_approve": false
    }
  ],
  "fallback": {
    "when_missing": [
      "brand workspace"
    ],
    "mode": "degraded"
  },
  "last_verified": null,
  "status": "beta",
  "required_providers": []
}
