{
  "slug": "product-fidelity",
  "type": "capability",
  "summary": "Lock the real product as an entity, choose a production method that preserves it, and audit outputs for drift",
  "tags": [
    "product",
    "packshot",
    "fidelity",
    "compositing"
  ],
  "triggers": [
    "packshot",
    "product photo",
    "label looks wrong",
    "product looks off",
    "PDP image"
  ],
  "required_inputs": [
    "product masters"
  ],
  "outputs": [
    "brand/brand-world.json",
    "work/*/fidelity.md"
  ],
  "cost_class": "medium",
  "context_class": "m",
  "mutating": true,
  "handoff": [
    "image-edit",
    "brand-verify",
    "creative-review",
    "learn-loop"
  ],
  "last_verified": null,
  "status": "beta",
  "required_providers": []
}
