{
  "slug": "video-direction",
  "type": "composite",
  "summary": "Direct AI and hybrid video: outcome branch, beat sheet, one world, production path per beat, ethics and disclosure gates, stills then probes then finals with a stop condition",
  "tags": [
    "video",
    "film",
    "ad",
    "reel",
    "beat sheet",
    "image-to-video",
    "ugc"
  ],
  "triggers": [
    "product video",
    "brand film",
    "video ad",
    "reel",
    "tiktok",
    "animate the logo",
    "explainer video",
    "ugc ad",
    "presenter video"
  ],
  "required_inputs": [
    "brief",
    "channels",
    "references"
  ],
  "outputs": [
    "work/*/beats.yaml",
    "work/*/direction.md"
  ],
  "cost_class": "high",
  "context_class": "m",
  "mutating": true,
  "handoff": [
    "prompt-director",
    "model-router",
    "generate-media",
    "product-fidelity",
    "three-d",
    "video-assembly",
    "claims-proof",
    "creative-review"
  ],
  "approval_gates": [
    {
      "id": "beat-sheet",
      "after_step": "beat sheet",
      "artifact": "work/*/beats.yaml",
      "never_self_approve": false
    },
    {
      "id": "spend-finals",
      "after_step": "probes",
      "artifact": "work/flows/*.flow.yaml",
      "never_self_approve": false
    },
    {
      "id": "presenter-ethics",
      "after_step": "gates",
      "artifact": "work/*/direction.md",
      "never_self_approve": true
    }
  ],
  "depends_on_fields": [
    "motion",
    "product_representation",
    "voice"
  ],
  "required_providers": [],
  "fallback": {
    "when_missing": [
      "FAL_KEY",
      "video model"
    ],
    "mode": "degraded"
  },
  "last_verified": "2026-10-03",
  "status": "beta"
}
