{
  "slug": "identity-system",
  "type": "composite",
  "summary": "Turn a chosen identity direction into DTCG tokens, type hierarchy, grid and composition rules, logo usage and component contracts",
  "tags": [
    "identity",
    "tokens",
    "typography",
    "grid",
    "motion"
  ],
  "triggers": [
    "design system",
    "tokens",
    "type scale",
    "grid",
    "brand system",
    "logo usage rules"
  ],
  "required_inputs": [
    "selected direction",
    "owner decision"
  ],
  "outputs": [
    "brand/tokens/*.tokens.json",
    "brand/rules/brand-rules.yaml",
    "work/system/specimen.html"
  ],
  "cost_class": "free",
  "context_class": "m",
  "mutating": true,
  "handoff": [
    "type-director",
    "symbol-design",
    "vector-master",
    "brand-verify",
    "copywriting"
  ],
  "approval_gates": [
    {
      "id": "system",
      "after_step": "specimen",
      "artifact": "work/system/specimen.html",
      "never_self_approve": true
    }
  ],
  "last_verified": null,
  "status": "beta",
  "required_providers": []
}
