{
  "slug": "model-router",
  "type": "capability",
  "summary": "Pick the current best model for a job from the dated registry, verify freshness, micro-benchmark when uncertain, record why and a fallback chain",
  "tags": [
    "models",
    "routing",
    "benchmark",
    "providers"
  ],
  "triggers": [
    "which model",
    "best model for",
    "model is stale",
    "switch model",
    "benchmark models"
  ],
  "required_inputs": [
    "job capabilities"
  ],
  "outputs": [
    "work/routing/*.md",
    "registry/models.json"
  ],
  "cost_class": "low",
  "context_class": "s",
  "mutating": true,
  "handoff": [
    "prompt-director",
    "generate-media",
    "creative-autoresearch"
  ],
  "last_verified": null,
  "status": "beta",
  "required_providers": []
}
