{
  "slug": "workflow",
  "type": "playbook",
  "summary": "Run create-brand, import-brand, campaign, product-photoshoot, growth-creative (alias paid-social), landing-page, packaging or deck as a resumable plan",
  "tags": [
    "workflow",
    "orchestration",
    "plan"
  ],
  "triggers": [
    "create a brand",
    "import our brand",
    "campaign",
    "product shoot",
    "paid social",
    "landing page",
    "packaging",
    "deck",
    "resume"
  ],
  "required_inputs": [
    "workflow name",
    "workspace"
  ],
  "outputs": [
    "work/plans/*.md"
  ],
  "cost_class": "medium",
  "context_class": "m",
  "mutating": true,
  "handoff": [
    "brief",
    "learn-loop"
  ],
  "last_verified": null,
  "status": "beta",
  "required_providers": []
}
