{
  "slug": "symbol-design",
  "type": "capability",
  "summary": "Explore and direct marks like an identity studio: brief as mechanisms, category silhouettes, canon, wide cheap exploration judged in one colour at 32 px, construction grids, 2-3 directions",
  "tags": [
    "logo",
    "symbol",
    "monogram",
    "mark",
    "identity"
  ],
  "triggers": [
    "new logo",
    "logo design",
    "symbol",
    "monogram",
    "brand mark",
    "refresh the logo",
    "secondary mark"
  ],
  "required_inputs": [
    "brief",
    "applications list"
  ],
  "outputs": [
    "work/marks/"
  ],
  "cost_class": "low",
  "context_class": "s",
  "mutating": true,
  "handoff": [
    "vector-master",
    "identity-system",
    "creative-review",
    "competitor-intel"
  ],
  "approval_gates": [
    {
      "id": "directions",
      "after_step": "shortlist",
      "artifact": "work/marks/*/directions.md",
      "never_self_approve": true
    }
  ],
  "depends_on_fields": [
    "logo_marks"
  ],
  "required_providers": [],
  "fallback": {
    "when_missing": [
      "vector model",
      "Chromium"
    ],
    "mode": "degraded"
  },
  "last_verified": "2026-10-03",
  "status": "beta"
}
