{
  "slug": "campaign-sequence",
  "type": "composite",
  "summary": "Plan and critique a campaign as a sequence of shot roles with jobs, DNA and channel crops",
  "tags": [
    "campaign",
    "sequence",
    "shot roles",
    "channels"
  ],
  "triggers": [
    "campaign plan",
    "shot list",
    "sequence",
    "images lack narrative",
    "channel adaptation"
  ],
  "required_inputs": [
    "direction",
    "channels"
  ],
  "outputs": [
    "campaigns/*.campaign.yaml",
    "work/campaigns/*/sequence.png"
  ],
  "cost_class": "free",
  "context_class": "m",
  "mutating": true,
  "handoff": [
    "shot-dna",
    "prompt-director",
    "product-fidelity",
    "copywriting",
    "creative-review"
  ],
  "last_verified": null,
  "status": "beta",
  "required_providers": []
}
