{
  "slug": "mockup",
  "type": "capability",
  "summary": "Composite approved art into realistic placements by template math, harmonize light outside the protected region, paste back and verify by inverse warp",
  "tags": [
    "mockup",
    "packaging",
    "label",
    "apparel",
    "signage",
    "device",
    "composite",
    "merch",
    "tote",
    "t-shirt",
    "billboard",
    "storefront",
    "can",
    "bottle"
  ],
  "triggers": [
    "mockup",
    "mock up",
    "show the label on",
    "logo on a",
    "packaging render",
    "merch mockup",
    "device mockup",
    "ad in the feed"
  ],
  "required_inputs": [
    "approved art",
    "placement list"
  ],
  "outputs": [
    "work/mockups/"
  ],
  "cost_class": "low",
  "context_class": "s",
  "mutating": true,
  "handoff": [
    "product-fidelity",
    "image-edit",
    "three-d",
    "video-direction",
    "creative-review",
    "brand-verify"
  ],
  "approval_gates": [
    {
      "id": "client-facing",
      "after_step": "verify",
      "artifact": "work/mockups/*/report.md",
      "never_self_approve": true
    }
  ],
  "depends_on_fields": [
    "logo_marks",
    "packaging_rules",
    "product_representation"
  ],
  "required_providers": [],
  "fallback": {
    "when_missing": [
      "template",
      "Chromium",
      "FAL_KEY"
    ],
    "mode": "degraded"
  },
  "last_verified": "2026-10-03",
  "status": "beta"
}
