{
  "slug": "learn-loop",
  "type": "capability",
  "summary": "Capture corrections, pairs, failures and quirks; run the taste loop; promote repeated evidence with provenance; weekly retro",
  "tags": [
    "learning",
    "memory",
    "retro",
    "preferences"
  ],
  "triggers": [
    "remember this",
    "never do this again",
    "retro",
    "what did we learn",
    "owner correction",
    "do not relearn"
  ],
  "required_inputs": [
    "state events"
  ],
  "outputs": [
    "state/learnings.jsonl",
    "docs/learnings.md",
    "work/retro/*.md"
  ],
  "cost_class": "free",
  "context_class": "s",
  "mutating": true,
  "handoff": [
    "prompt-director",
    "brand-verify",
    "model-router",
    "identity-system",
    "creative-autoresearch"
  ],
  "approval_gates": [
    {
      "id": "promote",
      "after_step": "promote",
      "artifact": "learning",
      "never_self_approve": true
    }
  ],
  "last_verified": null,
  "status": "beta",
  "required_providers": []
}
