{
  "slug": "flow-research",
  "type": "capability",
  "summary": "Research and design the best stepped method for an outcome before making anything; compare candidates, write a flow with gates and a cost ladder",
  "tags": [
    "method",
    "research",
    "planning",
    "flows"
  ],
  "triggers": [
    "how should we make",
    "best way to",
    "new kind of output",
    "no flow for this",
    "stale flow",
    "3d hero",
    "ai film",
    "mockup system"
  ],
  "required_inputs": [
    "outcome in the owner's words"
  ],
  "outputs": [
    "flows/*.flow.yaml",
    "work/flows/*.flow.yaml"
  ],
  "cost_class": "low",
  "context_class": "m",
  "mutating": true,
  "handoff": [
    "workflow",
    "model-router",
    "generate-media",
    "three-d",
    "video-direction",
    "mockup",
    "vector-master",
    "learn-loop"
  ],
  "approval_gates": [
    {
      "id": "plan",
      "after_step": "plan the run",
      "artifact": "work/flows/*.flow.yaml",
      "never_self_approve": false
    }
  ],
  "fallback": {
    "when_missing": [
      "web access"
    ],
    "mode": "degraded"
  },
  "last_verified": null,
  "status": "beta",
  "required_providers": []
}
