{
  "slug": "claims-proof",
  "type": "capability",
  "summary": "Claims architecture tied to proof and current primary regulatory sources per jurisdiction, marking uncertainty",
  "tags": [
    "claims",
    "compliance",
    "regulatory",
    "proof",
    "packaging"
  ],
  "triggers": [
    "can we say",
    "claim",
    "compliance",
    "label requirements",
    "ANVISA",
    "FDA",
    "mandatory statements"
  ],
  "required_inputs": [
    "claims",
    "jurisdictions"
  ],
  "outputs": [
    "work/claims/*.md"
  ],
  "cost_class": "low",
  "context_class": "m",
  "mutating": true,
  "handoff": [
    "copywriting"
  ],
  "approval_gates": [
    {
      "id": "counsel",
      "after_step": "risk rating",
      "artifact": "work/claims/*.md",
      "never_self_approve": true
    }
  ],
  "last_verified": null,
  "status": "beta",
  "required_providers": []
}
