{
  "slug": "image-edit",
  "type": "capability",
  "summary": "Repair one region or composite official assets while preserving everything else; crop, edit, paste back, match",
  "tags": [
    "edit",
    "retouch",
    "composite",
    "inpaint"
  ],
  "triggers": [
    "fix this part",
    "hands wrong",
    "label wrong",
    "retouch",
    "composite the logo",
    "one region"
  ],
  "required_inputs": [
    "source image",
    "region",
    "defect"
  ],
  "outputs": [
    "work/*/v*/"
  ],
  "cost_class": "low",
  "context_class": "s",
  "mutating": true,
  "handoff": [
    "product-fidelity",
    "creative-review",
    "brand-verify"
  ],
  "last_verified": null,
  "status": "beta",
  "required_providers": []
}
