{
  "slug": "taste-search",
  "type": "capability",
  "summary": "Find and curate near, middle and far references with Source, Mechanism, Transfer, rights and do-not-copy across the user's research tools",
  "tags": [
    "references",
    "taste",
    "research",
    "associative distance"
  ],
  "triggers": [
    "references",
    "moodboard",
    "inspiration",
    "what should it look like",
    "find examples",
    "reference packet"
  ],
  "required_inputs": [
    "brief or intent"
  ],
  "outputs": [
    "references/*/*.reference.yaml",
    "work/references/*-packet.md"
  ],
  "cost_class": "low",
  "context_class": "m",
  "mutating": true,
  "handoff": [
    "shot-dna",
    "creative-direction",
    "prompt-director",
    "brand-import"
  ],
  "fallback": {
    "when_missing": [
      "research tools"
    ],
    "mode": "local"
  },
  "last_verified": null,
  "status": "beta",
  "required_providers": []
}
